{
  "$schema": "https://json-schema.org/draft/2020-12/schema",
  "$id": "dirac-protocol.schema.json",
  "title": "Dirac wire vocabulary",
  "description": "Each table maps PascalCase identifiers to protocol values. Go constants and TypeScript keys derive from those identifiers. Every table requires at least one value. An empty table supplies no dispatch case and prevents the generator from checking coverage.",
  "type": "object",
  "additionalProperties": false,
  "required": [
    "_readme",
    "modes",
    "defaultMode",
    "configIds",
    "toolNames",
    "notices"
  ],
  "$defs": {
    "table": {
      "type": "object",
      "minProperties": 1,
      "propertyNames": {
        "pattern": "^[A-Z][A-Za-z0-9]*$"
      },
      "additionalProperties": {
        "type": "string",
        "minLength": 1
      }
    },
    "unread": {
      "description": "This map states per-key reader exemptions. contractsAreConsumed.test.mjs checks each key on every declared reader side. A key that one side does not consume must state its reason here.",
      "type": "object",
      "minProperties": 1,
      "additionalProperties": {
        "type": "object",
        "minProperties": 1,
        "propertyNames": {
          "pattern": "^[A-Z][A-Za-z0-9]*$"
        },
        "additionalProperties": {
          "type": "object",
          "additionalProperties": false,
          "required": [
            "sides",
            "why"
          ],
          "properties": {
            "sides": {
              "type": "array",
              "minItems": 1,
              "uniqueItems": true,
              "items": {
                "enum": [
                  "go",
                  "ts"
                ]
              }
            },
            "why": {
              "type": "string",
              "minLength": 31
            }
          }
        }
      }
    },
    "structs": {
      "description": "The generator derives each Go field tag from the shared table.",
      "type": "object",
      "minProperties": 1,
      "propertyNames": {
        "pattern": "^[A-Z][A-Za-z0-9]*$"
      },
      "additionalProperties": {
        "type": "object",
        "additionalProperties": false,
        "required": [
          "table",
          "fields"
        ],
        "properties": {
          "doc": {
            "type": "string",
            "minLength": 1
          },
          "table": {
            "type": "string",
            "minLength": 1
          },
          "fields": {
            "type": "array",
            "minItems": 1,
            "items": {
              "type": "object",
              "additionalProperties": false,
              "required": [
                "key",
                "type"
              ],
              "properties": {
                "key": {
                  "type": "string",
                  "pattern": "^[A-Z][A-Za-z0-9]*$"
                },
                "type": {
                  "type": "string",
                  "minLength": 1
                },
                "omitempty": {
                  "type": "boolean"
                },
                "table": {
                  "type": "string",
                  "minLength": 1
                }
              }
            }
          }
        }
      }
    }
  },
  "properties": {
    "_readme": {
      "type": "string",
      "minLength": 1
    },
    "_unread": {
      "$ref": "#/$defs/unread"
    },
    "modes": {
      "$ref": "#/$defs/table"
    },
    "defaultMode": {
      "description": "The modes key that a fresh session uses. The generator requires the key to exist in the modes table.",
      "type": "string",
      "pattern": "^[A-Z][A-Za-z0-9]*$"
    },
    "configIds": {
      "$ref": "#/$defs/table"
    },
    "notices": {
      "$ref": "#/$defs/table"
    },
    "toolNames": {
      "$ref": "#/$defs/table"
    }
  }
}
